{
  "weight": 6,
  "hours": [
    1,
    5
  ],
  "maxAffinity": 34,
  "steps": [
    {
      "look": {
        "select": [
          "!目/*ジト目",
          "!口/*えー"
        ],
        "show": [
          "!汗・涙/汗1"
        ],
        "voice": {
          "style_weights": {
            "Angry": 1
          }
        }
      },
      "text": "……まだ起きてんの。",
      "reading": "……まだおきてんの。"
    }
  ]
}
