{
  "weight": 4,
  "minAffinity": 35,
  "maxAffinity": 69,
  "steps": [
    {
      "look": {
        "select": [
          "!奥の腕/*ばんざい",
          "!手前の腕/*ばんざい",
          "!口/*えあー",
          "!目/*基本目セット/*目そらし1",
          "!目/*基本目セット/!白目/*白目見開き",
          "!眉/*上がり"
        ],
        "show": [
          "!汗・涙/汗1"
        ],
        "voice": {
          "style_weights": {
            "Happy": 0.5,
            "Normal": 0.5
          }
        }
      },
      "text": "わっ、びっくりした。",
      "reading": "わっ、びっくりした。"
    }
  ]
}
