{
  "weight": 5,
  "minAffinity": 50,
  "maxAffinity": 69,
  "steps": [
    {
      "look": {
        "select": [
          "!奥の腕/*腰",
          "!手前の腕/*腰",
          "!口/*む",
          "!目/*基本目セット/!白目/*白目ジト",
          "!眉/*怒り1"
        ],
        "voice": {
          "style_weights": {
            "Angry": 1
          }
        }
      },
      "text": "もー、しつこい。",
      "reading": "もー、しつこい。"
    }
  ]
}
