{
  "weight": 6,
  "hours": [
    1,
    5
  ],
  "minAffinity": 50,
  "steps": [
    {
      "look": {
        "select": [
          "!奥の腕/*呼びかけ",
          "!口/*えー",
          "!目/*基本目セット/*カメラ目線1",
          "!眉/*困り"
        ],
        "show": [
          "!汗・涙/汗1"
        ],
        "voice": {
          "style_weights": {
            "Sad": 1
          }
        }
      },
      "text": "もう遅いよ。ちゃんと寝なね？",
      "reading": "もうおそいよ。ちゃんとねなね？"
    }
  ]
}
